{
  "schema_version": "1.2.0",
  "filing_id": "sec-0001628280-26-049213",
  "source_artifact": {
    "artifact_id": "earnings-release",
    "filename": "exhibit991.htm",
    "document_type": "EX-99.1",
    "sha256": "7a11dac29614b2a88d8e653de56bf074c35bd13f1289a471e81e5ea0e1a589cf"
  },
  "document": {
    "title": "Tesla, Inc. 8-K for period ended 2026-06-30",
    "source_title": "exhibit991",
    "language": "en",
    "company_name": "Tesla, Inc.",
    "form_type": "8-K",
    "filing_date": "2026-07-22",
    "period_end_date": "2026-06-30",
    "event_date": "2026-07-22",
    "items": [
      "2.02",
      "9.01"
    ]
  },
  "page_count": 34,
  "sections": [],
  "blocks": [
    {
      "id": "b0001",
      "order": 1,
      "section_id": null,
      "type": "paragraph",
      "source": {
        "page_number": 1,
        "path": "/html/body[1]/div[1]/div[1]/div[1]/div[1]"
      },
      "text": "Q2 2026 Update 1 Exhibit 99.1"
    },
    {
      "id": "b0002",
      "order": 2,
      "section_id": null,
      "type": "paragraph",
      "source": {
        "page_number": 2,
        "path": "/html/body[1]/div[1]/div[1]/div[2]/div[1]"
      },
      "text": "Highlights 03 Financial Summary 04 Operational Summary 05 Manufacturing & Hardware 06 Supporting Infrastructure 07 AI & Software 08 Services 09 Outlook 10 Photos & Charts 11 Key Metrics 23 Financial Statements 26 Additional Information 32 2"
    },
    {
      "id": "b0003",
      "order": 3,
      "section_id": null,
      "type": "paragraph",
      "source": {
        "page_number": 3,
        "path": "/html/body[1]/div[1]/div[1]/div[3]/div[1]"
      },
      "text": "S U M M A R YH I G H L I G H T S (1) Refer to the Reconciliation of GAAP to Non–GAAP Financial Information slide (2) Free cash flow = operating cash flow less capex; (3) Includes cash, cash equivalents and short-term investments; (4)Active driver supervision required; does not make the vehicle autonomous; (5) Bay Area operations use FSD (Supervised) pursuant to CA TCP permit # TCP0046782 – A; Note: all information herein refers to the current quarter unless otherwise noted. Profitability $0.4B GAAP operating income $1.1B GAAP net income $1.2B non-GAAP net income1 Q2 was a strong quarter for our core vehicle, energy and services businesses as well as our manufacturing, infrastructure and AI initiatives. Our focus remains on strengthening these core businesses and making the necessary investments that will deliver Amazing Abundance. Tesla generated over $100B in revenue on a trailing twelve-month basis for the first time. We achieved record second-quarter vehicle deliveries, with continued growth in new markets and strength in established markets. Our Energy Storage business returned to growth, achieving its second-best quarterly deployment number and record deployments on a trailing twelve-month basis. The Services and Other business achieved record profitability and margin in the quarter. Cybercab began production at Gigafactory Texas, and Tesla Semi remains on track for production this year at our new factory in Nevada. Progress also continued on battery pack capacity expansion – the main limiting factor to near-term vehicle production volume increase. Megafactory Texas is nearing completion, with start of production planned for this year. Additionally, site selection, preparation, construction and equipment procurement progressed in the quarter for solar and semiconductor manufacturing. FSD (Supervised)4 penetration continued to grow in the quarter with more customers opting for subscription at the time of vehicle purchase. Robotaxi rollout continued in the U.S. and is now live in seven major metros5. Construction at our Fremont Factory for Optimus began after we decommissioned the Model S & X lines, with anticipated production later this year. Tesla is in its largest and most exciting period of investment. From here, there remains much hard work as we aim to revolutionize transportation, energy and productivity through our leading real-world AI. Scaling will be non-linear, and we are focused on long-term value creation. We’ve never been more optimistic about the future. Cash Operating cash flow of $4.7B Free cash flow2 of negative $1.1B $1.2B decrease in our cash and investments3 Operations Record Q2 vehicle deliveries Launched Robotaxi in three cities in Florida in July Began production of Cybercab 3"
    },
    {
      "id": "b0004",
      "order": 4,
      "section_id": null,
      "type": "paragraph",
      "source": {
        "page_number": 4,
        "path": "/html/body[1]/div[1]/div[1]/div[4]/div[1]"
      },
      "text": "F I N A N C I A L S U M M A R Y (Unaudited) ($ in millions, except percentages and per share data) Q2-2025 Q3-2025 Q4-2025 Q1-2026 Q2-2026 YoY Total automotive revenues 16,661 21,205 17,693 16,234 20,516 23% Energy generation and storage revenue 2,789 3,415 3,837 2,408 3,139 13% Services and other revenue 3,046 3,475 3,371 3,745 4,581 50% Total revenues 22,496 28,095 24,901 22,387 28,236 26% Total gross profit 3,878 5,054 5,009 4,720 4,751 23% Total GAAP gross margin 17.2% 18.0% 20.1% 21.1% 16.8% -41 bp Operating expenses 2,955 3,430 3,600 3,779 4,353 47% Income from operations 923 1,624 1,409 941 398 -57% Operating margin 4.1% 5.8% 5.7% 4.2% 1.4% -269 bp Adjusted EBITDA 3,401 4,227 4,154 3,668 3,273 -4% Adjusted EBITDA margin 15.1% 15.0% 16.7% 16.4% 11.6% -353 bp Net income attributable to common stockholders (GAAP) 1,172 1,373 840 477 1,114 -5% Net income attributable to common stockholders (non-GAAP) 1,393 1,770 1,761 1,453 1,153 -17% EPS attributable to common stockholders, diluted (GAAP) 0.33 0.39 0.24 0.13 0.32 -3% EPS attributable to common stockholders, diluted (non-GAAP) 0.40 0.50 0.50 0.41 0.33 -18% Net cash provided by operating activities 2,540 6,238 3,813 3,937 4,697 85% Capital expenditures (2,394) (2,248) (2,393) (2,493) (5,789) 142% Free cash flow 146 3,990 1,420 1,444 (1,092) -848% Cash, cash equivalents and short-term investments 36,782 41,647 44,059 44,743 43,524 18% 4"
    },
    {
      "id": "b0005",
      "order": 5,
      "section_id": null,
      "type": "paragraph",
      "source": {
        "page_number": 5,
        "path": "/html/body[1]/div[1]/div[1]/div[5]/div[1]"
      },
      "text": "Q2-2025 Q3-2025 Q4-2025 Q1-2026 Q2-2026 YoY Model 3/Y production 396,835 435,826 422,652 394,611 442,936 12% Other models production 13,409 11,624 11,706 13,775 8,822 -34% Total production 410,244 447,450 434,358 408,386 451,758 10% Model 3/Y deliveries 373,728 481,166 406,585 341,893 467,762 25% Other models deliveries 10,394 15,933 11,642 16,130 12,364 19% Total deliveries 384,122 497,099 418,227 358,023 480,126 25% of which subject to operating lease accounting 6,670 10,230 10,996 3,430 7,580 14% Cumulative deliveries(1) (all-time; mil) 8.0 8.5 8.9 9.2 9.7 21% Active FSD Subscriptions(2) (mil) 0.95 1.04 1.10 1.28 1.48 56% Total end of quarter operating lease (new vehicle) count(3) 172,882 167,163 163,075 151,991 141,876 -18% Global vehicle inventory (days of supply)(4) 24 10 15 27 15 -38% Storage deployed (GWh) 9.6 12.5 14.2 8.8 13.5 41% Supercharger stations 7,377 7,753 8,182 8,463 8,704 18% Supercharger connectors 70,228 73,817 77,682 79,918 82,357 17% O P E R A T I O N A L S U M M A R Y (Unaudited) 5 (1) In accordance with our 2025 CEO Performance Award, metric includes all new Tesla vehicles delivered to customers plus any unsupervised Robotaxis placed into commercial operation. For further detail see our 2025 Proxy Statement. (2) In accordance with our 2025 CEO Performance Award, metric includes both upfront payment and monthly subscriptions and excludes free trials. For further detail see our 2025 Proxy Statement. (3) Beginning in Q4’25, end of quarter operating lease count pertains only to new vehicles. Q3’25 has been adjusted to exclude used vehicles. (4) Days of supply is calculated by dividing new vehicle ending inventory by the relevant quarter’s deliveries and using 75 trading days (aligned with Automotive News definition)."
    },
    {
      "id": "b0006",
      "order": 6,
      "section_id": null,
      "type": "paragraph",
      "source": {
        "page_number": 6,
        "path": "/html/body[1]/div[1]/div[1]/div[6]/div[1]"
      },